<?xml version="1.0" encoding="UTF-8"?>
<ConfigurationCommands
	xmlns="http://www.incalza.it/myhome/input/controller/configuration"
	xmlns:xsi="http://www.w3.org/2001/XMLSchema-instance"
	xsi:schemaLocation="http://www.incalza.it/myhome/input/controller/configuration ../xsd/configuration.xsd ">
	<Commands>
		<Command actionComand="ON">
			<OpenWebNetComands>
				<OpenWebNetComand>*1*1*61##</OpenWebNetComand>
				<OpenWebNetComand>*1*1*62##</OpenWebNetComand>
			</OpenWebNetComands>
		</Command>
		<Command actionComand="OFF">
			<OpenWebNetComands>
				<OpenWebNetComand>*1*0*61##</OpenWebNetComand>
				<OpenWebNetComand>*1*0*62##</OpenWebNetComand>
			</OpenWebNetComands>
		</Command>
		<Command actionComand="NORTH">
			<OpenWebNetComands>
				<OpenWebNetComand>*2*1*51##</OpenWebNetComand>
			</OpenWebNetComands>
		</Command>
		<Command actionComand="SOUTH">
			<OpenWebNetComands>
				<OpenWebNetComand>*2*2*51##</OpenWebNetComand>
			</OpenWebNetComands>
		</Command>
		<Command actionComand="EAST">
			<OpenWebNetComands>
				<OpenWebNetComand>*2*1*52##</OpenWebNetComand>
			</OpenWebNetComands>
		</Command>
		<Command actionComand="WEST">
			<OpenWebNetComands>
				<OpenWebNetComand>*2*2*52##</OpenWebNetComand>
			</OpenWebNetComands>
		</Command>
	</Commands>
</ConfigurationCommands>
